What does it do?,what_classifier_does
what does NLClassifier do?,what_classifier_does
How can NL classifier service help customers ?,what_classifier_does
What does NL stand for?,what_does_nl_stand_for
Why do I want to use the Natural Language Classifier?,why_use_classifier
Why would I want to use the NL Classifier service  in my app?,why_use_classifier
What benefit will I get from using the NL Classifier service?,why_use_classifier
What value does the classifier service bring,why_use_classifier
Why do I need a Natural Language Classifier?,why_use_classifier
What are the benefits of the NLClassifier?,why_use_classifier
Why do I want to use NL Classifier?,why_use_classifier